{
  "contractVersion": 1,
  "requestId": "req-0002",
  "sessionGeneration": 3,
  "observationId": "obs-0001",
  "modelConfigurationId": "gui-actor-2b-fp16@0.1.0",
  "candidates": [
    {
      "geometry": {
        "point": {
          "x": 488.0,
          "y": 244.0
        },
        "region": {
          "x": 460,
          "y": 230,
          "w": 56,
          "h": 28
        }
      },
      "coordinateSpace": "model_input_pixels",
      "imageDimensions": {
        "widthPx": 1008,
        "heightPx": 672
      },
      "scores": [
        {
          "name": "attention",
          "value": 0.91,
          "semantics": "attention_activation",
          "version": "dec-v1"
        },
        {
          "name": "region_mean",
          "value": 0.78,
          "semantics": "region_mean_activation",
          "version": "dec-v1"
        }
      ]
    }
  ],
  "preprocessing": {
    "resize": {
      "method": "lanczos",
      "outWidthPx": 1008,
      "outHeightPx": 672
    },
    "modelInputDimensions": {
      "widthPx": 1008,
      "heightPx": 672
    },
    "transformToCapture": {
      "scaleX": 1.9047619047619049,
      "scaleY": 1.6071428571428572,
      "offsetX": 0.0,
      "offsetY": 0.0
    }
  },
  "diagnostics": {
    "executionProvider": "cpu",
    "inferenceMs": 980.0
  }
}
